{
  "schema_version": 1,
  "conversation_id": "fixture-conversation",
  "event_id": "fixture-event",
  "run_id": "fixture-run",
  "wave": "wave-1",
  "kind": "completed",
  "notification_type": "result",
  "problem_title": "Fixture scenario",
  "summary": "Fixture evidence reached a terminal result.",
  "decision_artifact": {
    "path": "loops/fixture-run/wave-1/merge.md",
    "sha256": "0000000000000000000000000000000000000000000000000000000000000000"
  },
  "full_verdict_available": false
}
